{
  "schemaVersion": 1,
  "id": "my-spring-wardrobe-v1",
  "name": "春の小さなクローゼット",
  "items": [
    {
      "id": "ribbon-dress",
      "name": "春色のリボンワンピース",
      "category": "C",
      "palettes": ["アイボリー × スモークピンク", "ラベンダー × クリーム"],
      "details": ["小さなリボンと柔らかなプリーツ、袖口に細い刺繍", "丸い襟と共布のウエストリボン、控えめな花柄"],
      "tags": ["ワンピース", "春", "やわらかい", "リボン"],
      "source": "自分のアイデア"
    }
  ]
}
